{
  "schema_version": 1,
  "theme": "classic",
  "locale": "pt-BR",
  "target_role": "Senior Rust Engineer",
  "basics": {
    "name": "Ana Souza",
    "headline": "Senior Rust Engineer",
    "email": "ana.souza@example.com",
    "phone": "+55 11 99999-9999",
    "location": "São Paulo, BR",
    "summary": "Engenheira de software com foco em Rust, automação e ferramentas para desenvolvedores.",
    "links": [
      { "label": "LinkedIn", "url": "https://www.linkedin.com/in/anasouza" },
      { "label": "GitHub", "url": "https://github.com/anasouza" }
    ]
  },
  "work": [
    {
      "company": "Acme Tech",
      "position": "Staff Software Engineer",
      "start_date": "2022-01",
      "end_date": "Present",
      "location": "Remote",
      "highlights": [
        "Liderou a migração de serviços internos críticos para Rust, reduzindo latência em 37%.",
        "Automatizou pipelines de entrega e validou currículos com foco em ATS para times de recrutamento."
      ]
    }
  ],
  "education": [
    {
      "institution": "Universidade Federal de Minas Gerais",
      "area": "Ciência da Computação",
      "study_type": "Bacharelado",
      "start_date": "2012",
      "end_date": "2016"
    }
  ],
  "skills": [
    { "category": "Linguagens", "items": ["Rust", "Python", "TypeScript"] }
  ],
  "certifications": [],
  "projects": [],
  "languages": [],
  "awards": []
}
